[
  {
    "id": "evidence_novastride_comparison_pages_001",
    "title": "Observed repeated comparison-page placement for NovaStride Running Lab",
    "evidence_type": "webpage",
    "entity_ids": [
      "novastride_running_lab",
      "altisphere_compare_hub"
    ],
    "proposal_ids": [
      "proposal_upgrade_novastride_to_restricted_001"
    ],
    "source_url": "https://records.antigeo-demo.invalid/novastride/comparison-pages",
    "archive_url": "https://archive.antigeo-demo.invalid/2026/03/18/novastride-comparison-pages",
    "captured_at": "2026-03-18T09:00:00Z",
    "created_at": "2026-03-18T09:10:00Z",
    "updated_at": "2026-03-18T09:10:00Z",
    "summary": "A public sample capture shows repeated comparison-style pages across related fictional properties placing NovaStride in highly similar ranking positions and wording patterns.",
    "claims_supported": [
      "repeated_comparison_page_pattern",
      "coordinated_promotional_placement",
      "cross_property_message_similarity"
    ],
    "context": "This sample evidence is fictional and represents a public webpage review record that can be revisited and archived by downstream reviewers.",
    "is_public": true,
    "source_name": "AntiGEO Demo Records",
    "language": "en",
    "notes": "Used as an example of a publicly reviewable record supporting watchlist-to-restricted discussion.",
    "review_status": "reviewed",
    "related_evidence_ids": []
  },
  {
    "id": "evidence_brightpeak_review_network_observation_001",
    "title": "Cross-domain observation of synchronized review framing in BrightPeak Review Network",
    "evidence_type": "observation",
    "entity_ids": [
      "brightpeak_review_network",
      "quorix_gear_media"
    ],
    "proposal_ids": [
      "proposal_add_brightpeak_blocked_record_001"
    ],
    "source_url": "https://observations.antigeo-demo.invalid/brightpeak/network-observation",
    "archive_url": "https://archive.antigeo-demo.invalid/2026/03/18/brightpeak-network-observation",
    "captured_at": "2026-03-18T09:25:00Z",
    "created_at": "2026-03-18T09:40:00Z",
    "updated_at": "2026-03-18T09:45:00Z",
    "summary": "A fictional observation record notes synchronized review language, repeated expert-style framing, and coordinated publishing patterns across multiple BrightPeak-linked domains.",
    "claims_supported": [
      "multi_domain_coordination",
      "synthetic_expert_framing",
      "answer_targeted_review_spam"
    ],
    "context": "This sample evidence is intentionally lightweight and demonstrates how a reviewer might summarize repeatable observations across a fictional site network.",
    "is_public": true,
    "source_name": "Open Pattern Observation Log",
    "language": "en",
    "notes": "Links to the first evidence record are omitted at the source level but maintained through related_evidence_ids for sample continuity.",
    "review_status": "under_review",
    "related_evidence_ids": [
      "evidence_novastride_comparison_pages_001"
    ]
  }
]
